{
  "schema_version": "promotion-result.v1",
  "result_kind": "promotion_result",
  "candidate_identity": {
    "dataset_slug": "telco-customer-churn",
    "release_id": "release-20260829-006",
    "release_version": "1.0.0-rc.1"
  },
  "promotion_outcome": "promoted",
  "preconditions_verified": {
    "completeness_validation_outcome": "accepted",
    "manifest_valid": true,
    "all_required_hashes_present": true,
    "candidate_state_was_valid": true,
    "all_preconditions_met": true
  },
  "registry_update_record": {
    "update_applied": true,
    "new_active_release_id": "release-20260829-006",
    "previous_active_release_id": "release-20260829-005",
    "previous_release_preserved": true,
    "promoted_at": "2026-08-29T22:15:11Z",
    "registry_action": "updated"
  },
  "evidence_safety": {
    "reduced_evidence_only": true,
    "raw_logs_persisted": false,
    "raw_runtime_persisted": false,
    "raw_api_payloads_persisted": false,
    "secrets_persisted": false,
    "sensitive_local_paths_persisted": false,
    "raw_file_contents_persisted": false,
    "raw_artifact_contents_embedded": false
  },
  "promotion_boundaries": {
    "registry_write_implemented": false,
    "hash_calculation_implemented": false,
    "signing_or_key_management_implemented": false,
    "queue_required": false,
    "worker_required": false,
    "database_required": false,
    "public_endpoint_exposed": false,
    "web_administration_required": false,
    "github_mutation_performed": false
  }
}